{
  "format_version": "0.1",
  "generated_at": "2026-07-27T07:58:17.555166878Z",
  "build": {
    "version": "dev",
    "commit": "unknown",
    "date": "unknown",
    "dirty": "unknown",
    "go_version": "go1.23.2",
    "platform": "linux/amd64",
    "module": "github.com/SHOnnay/futurediff"
  },
  "host": {
    "goos": "linux",
    "goarch": "amd64"
  },
  "targets": [
    {
      "target": "local",
      "requested": true,
      "certified": true,
      "checks": [
        {
          "id": "mcp_binary",
          "status": "pass",
          "required": true,
          "detail": "executable exists",
          "evidence": {
            "path": "/mnt/data/fd_task024/futurediff/bin/futurediff-mcp"
          }
        },
        {
          "id": "daemon_socket",
          "status": "pass",
          "required": true,
          "detail": "daemon socket path is absolute",
          "evidence": {
            "path": "/tmp/futurediff-task024.sock"
          }
        },
        {
          "id": "opencode_profile_generation",
          "status": "pass",
          "required": true,
          "detail": "strict OpenCode profile generated"
        },
        {
          "id": "hermes_profile_generation",
          "status": "pass",
          "required": true,
          "detail": "strict Hermes profile generated"
        },
        {
          "id": "release_authority_absent",
          "status": "pass",
          "required": true,
          "detail": "generated agent profiles contain no approval, commit, or credential tool"
        }
      ]
    },
    {
      "target": "oci",
      "requested": false,
      "certified": false,
      "checks": [
        {
          "id": "not_requested",
          "status": "skip",
          "required": false,
          "detail": "target was not requested"
        }
      ]
    },
    {
      "target": "github",
      "requested": false,
      "certified": false,
      "checks": [
        {
          "id": "not_requested",
          "status": "skip",
          "required": false,
          "detail": "target was not requested"
        }
      ]
    },
    {
      "target": "slack",
      "requested": false,
      "certified": false,
      "checks": [
        {
          "id": "not_requested",
          "status": "skip",
          "required": false,
          "detail": "target was not requested"
        }
      ]
    },
    {
      "target": "opencode",
      "requested": false,
      "certified": false,
      "checks": [
        {
          "id": "not_requested",
          "status": "skip",
          "required": false,
          "detail": "target was not requested"
        }
      ]
    },
    {
      "target": "hermes",
      "requested": false,
      "certified": false,
      "checks": [
        {
          "id": "not_requested",
          "status": "skip",
          "required": false,
          "detail": "target was not requested"
        }
      ]
    },
    {
      "target": "attestation",
      "requested": false,
      "certified": false,
      "checks": [
        {
          "id": "not_requested",
          "status": "skip",
          "required": false,
          "detail": "target was not requested"
        }
      ]
    }
  ],
  "certified": true,
  "report_digest": "c3a95bc253b262f2af2a11e31100451fbf67e37ab5494448acee4fea8497b323"
}
